<?xml version="1.0" encoding="utf-8" ?>
<flights xmlns:xsi="http://www.w3.org/2001/XMLSchema-instance" xsi:noNamespaceSchemaLocation="flights.xsd">
  <airport>XYU</airport>
  <updatedDate>2020-01-15</updatedDate>
  <updatedTime>15:27:00</updatedTime>
  <arrivals>
    <arrival>
      <flight>8564</flight>
      <airline>Air Canada</airline>
      <flightFrom>Ottawa</flightFrom>
      <schedTime>13:50:09</schedTime>
      <actTime>13:50:09</actTime>
      <status>Arrived</status>
    </arrival>
    <arrival>
      <flight>4512</flight>
      <airline>Air Canada</airline>
      <flightFrom>Toronto</flightFrom>
      <schedTime>14:30:09</schedTime>
      <actTime>14:30:09</actTime>
      <status>Late</status>
    </arrival>
    <arrival>
      <flight>9588</flight>
      <airline>Swoop</airline>
      <flightFrom>Orlando</flightFrom>
      <schedTime>14:11:09</schedTime>
      <actTime>14:11:09</actTime>
      <status>Early</status>
    </arrival>
    <arrival>
      <flight>251</flight>
      <airline>Air Transat</airline>
      <flightFrom>Punta Cana</flightFrom>
      <schedTime>16:15:09</schedTime>
      <actTime>16:15:09</actTime>
      <status>On Time</status>
    </arrival>
    <arrival>
      <flight>2514</flight>
      <airline>WestJet</airline>
      <flightFrom>Calgary</flightFrom>
      <schedTime>22:16:09</schedTime>
      <actTime>22:16:09</actTime>
      <status>On Time</status>
    </arrival>
    <arrival>
      <flight>3522</flight>
      <airline>WestJet</airline>
      <flightFrom>Varadero</flightFrom>
      <schedTime>22:16:09</schedTime>
      <actTime>22:16:09</actTime>
      <status>On Time</status>
    </arrival>
    <arrival>
      <flight>2251</flight>
      <airline>Swoop</airline>
      <flightFrom>Las Vegas</flightFrom>
      <schedTime>22:16:09</schedTime>
      <actTime>22:16:09</actTime>
      <status>On Time</status>
    </arrival>
    <arrival>
      <flight>3754</flight>
      <airline>WestJet Encore</airline>
      <flightFrom>Hamilton</flightFrom>
      <schedTime>22:16:09</schedTime>
      <actTime>22:16:09</actTime>
      <status>On Time</status>
    </arrival>
  </arrivals>
  <departures>
    <departure>
      <flight>7741</flight>
      <airline>Air Canada</airline>
      <flightTo>Ottawa</flightTo>
      <schedTime>14:15:09</schedTime>
      <actTime>14:15:09</actTime>
      <status>Departed</status>
    </departure>
    <departure>
      <flight>2254</flight>
      <airline>Swoop</airline>
      <flightTo>Orlando</flightTo>
      <schedTime>16:00:09</schedTime>
      <actTime>16:00:09</actTime>
      <status>Delayed</status>
    </departure>
    <departure>
      <flight>7844</flight>
      <airline>Air Transat</airline>
      <flightTo>Cancun</flightTo>
      <schedTime>22:10:09</schedTime>
      <actTime>22:10:09</actTime>
      <status>On Time</status>
    </departure>
    <departure>
      <flight>90</flight>
      <airline>Air Canada</airline>
      <flightTo>Ottawa</flightTo>
      <schedTime>14:15:09</schedTime>
      <actTime>14:15:09</actTime>
      <status>Departed</status>
    </departure>
    <departure>
      <flight>998</flight>
      <airline>Sunwing</airline>
      <flightTo>Varadero</flightTo>
      <schedTime>22:10:09</schedTime>
      <actTime>22:15:09</actTime>
      <status>On Time</status>
    </departure>
  </departures>
</flights>