<?xml version="1.0" encoding="utf-8" ?>
<flights xmlns:xsi="http://www.w3.org/2001/XMLSchema-instance" xsi:noNamespaceSchemaLocation="flights.xsd">
  <airport>XYU</airport>
  <updatedDate>2020-01-15</updatedDate>
  <updatedTime>15:27:00</updatedTime>
  <arrivals>
    <arrival>
      <flight>5564</flight>
      <airline>Swoop</airline>
      <flightFrom>Abbotsford</flightFrom>
      <schedTime>13:50:09</schedTime>
      <actTime>13:50:09</actTime>
      <status>Arrived</status>
    </arrival>
    <arrival>
      <flight>2343</flight>
      <airline>Air Canada</airline>
      <flightFrom>Orlando</flightFrom>
      <schedTime>14:30:09</schedTime>
      <actTime>14:30:09</actTime>
      <status>Late</status>
    </arrival>
    <arrival>
      <flight>2545</flight>
      <airline>Swoop</airline>
      <flightFrom>Winnipeg</flightFrom>
      <schedTime>14:11:09</schedTime>
      <actTime>14:11:09</actTime>
      <status>Early</status>
    </arrival>
    <arrival>
      <flight>3453</flight>
      <airline>Sunwing</airline>
      <flightFrom>Sault Ste Marie</flightFrom>
      <schedTime>16:15:09</schedTime>
      <actTime>16:15:09</actTime>
      <status>On Time</status>
    </arrival>
    <arrival>
      <flight>6767</flight>
      <airline>WestJet Encore</airline>
      <flightFrom>Cayo Santa Maria</flightFrom>
      <schedTime>22:16:09</schedTime>
      <actTime>22:16:09</actTime>
      <status>On Time</status>
    </arrival>
  </arrivals>
  <departures>
    <departure>
      <flight>548</flight>
      <airline>Sunwing</airline>
      <flightTo>Varadero</flightTo>
      <schedTime>22:15:09</schedTime>
      <actTime>22:15:09</actTime>
      <status>On Time</status>
    </departure>
    <departure>
      <flight>3343</flight>
      <airline>Swoop</airline>
      <flightTo>Orlando</flightTo>
      <schedTime>16:00:09</schedTime>
      <actTime>16:00:09</actTime>
      <status>Delayed</status>
    </departure>
    <departure>
      <flight>55</flight>
      <airline>Air Canada</airline>
      <flightTo>Ottawa</flightTo>
      <schedTime>14:15:09</schedTime>
      <actTime>14:15:09</actTime>
      <status>Departed</status>
    </departure>
    <departure>
      <flight>4433</flight>
      <airline>Air Transat</airline>
      <flightTo>Cancun</flightTo>
      <schedTime>22:10:09</schedTime>
      <actTime>22:10:09</actTime>
      <status>On Time</status>
    </departure>
    <departure>
      <flight>2232</flight>
      <airline>Air Canada</airline>
      <flightTo>Ottawa</flightTo>
      <schedTime>14:15:09</schedTime>
      <actTime>14:15:09</actTime>
      <status>Departed</status>
    </departure>
  </departures>
</flights>