<?xml version="1.0" encoding="utf-8" ?>
<flights xmlns:xsi="http://www.w3.org/2001/XMLSchema-instance" xsi:noNamespaceSchemaLocation="flights.xsd">
  <airport>XYU</airport>
  <updatedDate>2020-01-15</updatedDate>
  <updatedTime>15:27:00</updatedTime>
  <arrivals>
    <arrival>
      <flight>8564</flight>
      <airline>Air Canada</airline>
      <flightFrom>Ottawa</flightFrom>
      <schedTime>13:50:09</schedTime>
      <actTime>13:50:09</actTime>
      <status>Arrived</status>
    </arrival>
    <arrival>
      <flight>4512</flight>
      <airline>Air Canada</airline>
      <flightFrom>Toronto</flightFrom>
      <schedTime>14:30:09</schedTime>
      <!-- a.i. An invalid number of Arrivals fields -->
      <status>Late</status>
    </arrival>
    <arrival>
      <flight>9588</flight>
      <airline>Swoop</airline>
      <flightFrom>Orlando</flightFrom>
      <schedTime>14:11:09</schedTime>
      <actTime>14:11:09</actTime>
      <status>Early</status>
    </arrival>
    <arrival>
      <flight>251</flight>
      <!-- a.ii. An Arrival field containing an invalid number of Airline fields -->
      <airline>Air Transat</airline>
      <airline>United</airline>
      <flightFrom>Punta Cana</flightFrom>
      <schedTime>16:15:09</schedTime>
      <actTime>16:15:09</actTime>
      <status>On Time</status>
    </arrival>
    <arrival>
      <flight>2514</flight>
      <airline>WestJet</airline>
      <flightFrom>Calgary</flightFrom>
      <schedTime>22:16:09</schedTime>
      <actTime>22:16:09</actTime>
      <status>On Time</status>
    </arrival>
    <arrival>
      <flight>3522</flight>
      <airline>WestJet</airline>
      <flightFrom>Varadero</flightFrom>
      <schedTime>22:16:09</schedTime>
      <actTime>22:16:09</actTime>
      <status>On Time</status>
    </arrival>
    <arrival>
      <flight>2251</flight>
      <!-- b.i. An invalid Airline value for an Arrival -->
      <airline>United</airline>
      <flightFrom>Las Vegas</flightFrom>
      <schedTime>22:16:09</schedTime>
      <actTime>22:16:09</actTime>
      <status>On Time</status>
    </arrival>
    <arrival>
      <flight>3754</flight>
      <airline>WestJet Encore</airline>
      <!-- b.ii An invalid Arriving From value for an Arrival -->
      <flightFrom>Vancouver</flightFrom>
      <schedTime>22:16:09</schedTime>
      <actTime>22:16:09</actTime>
      <status>On Time</status>
    </arrival>
  </arrivals>
  <departures>
    <departure>
      <flight>7741</flight>
      <airline>Air Canada</airline>
      <flightTo>Ottawa</flightTo>
      <schedTime>14:15:09</schedTime>
      <actTime>14:15:09</actTime>
      <!-- b.iii. An invalid Status value for an Arrival -->
      <status>Arrived</status>
    </departure>
    <departure>
      <flight>2254</flight>
      <!-- a.iii. A Departure field containing an invalid number of Depart To fields -->
      <flightTo>Orlando</flightTo>
      <schedTime>16:00:09</schedTime>
      <actTime>16:00:09</actTime>
      <status>Delayed</status>
    </departure>
    <departure>
      <flight>7844</flight>
      <airline>Air Transat</airline>
      <!-- b.iv. An invalid Departing To value for a Departure -->
      <flightTo>Los Angeles</flightTo>
      <schedTime>22:10:09</schedTime>
      <actTime>22:10:09</actTime>
      <!-- a.iv. An element (anywhere) that is not defined in the schema -->
      <currTime>10:04:21</currTime>
      <status>On Time</status>
    </departure>
    <departure>
      <!-- a.v. An attribute (anywhere) that is not defined in the schema -->
      <flight id="90">90</flight>
      <airline>Air Canada</airline>
      <flightTo>Ottawa</flightTo>
      <schedTime>14:15:09</schedTime>
      <actTime>14:15:09</actTime>
      <status>Departed</status>
    </departure>
    <departure>
      <!-- b.v. An invalid Flight value for a Departure -->
      <flight>A998</flight>
      <airline>Sunwing</airline>
      <flightTo>Varadero</flightTo>
      <schedTime>22:10:09</schedTime>
      <!-- b.vi. An invalid Actual Time value for a Departure -->
      <actTime>22:15</actTime>
      <status>On Time</status>
    </departure>
  </departures>
</flights>